"Title","Cen_Desf","Fund_Teor","Clar_Res","Ilustr","Repos","Qualid","Total","QP_count","QPs"
"Vision-Language Pre-Training with Triple Contrastive Learning","1","3","3","2","1","2","12","5","QP1,QP6,QP7,QS1,QS2"
"Active Supervised Cross-Modal Retrieval","2","3","3","2","1","2","13","7","QP1,QP2,QP4,QP6,QP7,QS1,QS2"
"PairAug: What Can Augmented Image-Text Pairs Do for Radiology?","2","2","3","2","1","2","12","7","QP1,QP5,QP6,QP7,QS1,QS3,QS4"
"Grounded Language-Image Pre-training","1","3","3","2","1","2","12","7","QP1,QP3,QP6,QP7,QS1,QS2,QS3"
"Fashion Image Retrieval with Text Feedback by Additive Attention Compositional Learning","0","2","2","1","0","1","6","3","QP1,QP5,QP6"
"Vision-Language Navigation with Random Environmental Mixup","1","2","2","2","0","1","8","6","QP1,QP2,QP6,QP7,QS2,QS3"
"Knowledge-Embedded Mutual Guidance for Visual Reasoning","0","2","2","2","0","1","7","5","QP1,QP2,QP6,QP7,QS2"
"Cross-Modality Image Interpretation via Concept Decomposition Vector of Visual-Language Models","1","2","2","2","0","1","8","6","QP1,QP5,QP6,QP7,QS2,QS4"
"Cross-Modal Alternating Learning With Task-Aware Representations for Continual Learning","1","2","2","2","1","1","9","5","QP1,QP5,QP6,QS1,QS2"
"Dissecting Deep Metric Learning Losses for Image-Text Retrieval","0","2","3","2","1","1","9","4","QP1,QP6,QP7,QS2"
"Freeze the Backbones: a Parameter-Efficient Contrastive Approach to Robust Medical Vision-Language Pre-Training","2","2","2","2","1","2","11","6","QP1,QP5,QP6,QS2,QS3,QS4"
"Enhancing Medical Vision-Language Contrastive Learning via Inter-Matching Relation Modeling","1","3","3","2","0","2","11","8","QP1,QP2,QP5,QP6,QP7,QS1,QS2,QS4"
"Application of Vision-Language Models for Assessing Osteoarthritis","2","1","2","1","0","1","7","6","QP1,QP5,QP6,QP7,QS2,QS4"
"Vision-Language Pre-Training for Boosting Scene Text Detectors","0","2","2","2","1","1","8","5","QP1,QP5,QP6,QS1,QS2"
"MedFILIP: Medical Fine-Grained Language-Image Pre-Training","2","2","2","2","1","2","11","7","QP1,QP5,QP6,QP7,QS2,QS3,QS4"
"Set-level Guidance Attack: Boosting Adversarial Transferability of Vision-Language Pre-training Models","0","2","2","2","1","1","8","5","QP1,QP6,QP7,QS1,QS2"
"Contrasting Intra-Modal and Ranking Cross-Modal Hard Negatives to Enhance Visio-Linguistic Compositional Understanding","1","3","3","2","1","2","12","5","QP1,QP6,QP7,QS1,QS2"
"ULIP: Learning a Unified Representation of Language, Images, and Point Clouds for 3D Understanding","1","3","3","2","1","2","12","6","QP1,QP6,QP7,QS1,QS2,QS3"
"SyncMask: Synchronized Attentional Masking for Fashion-centric Vision-Language Pretraining","1","2","2","2","0","1","8","6","QP1,QP5,QP6,QP7,QS2,QS3"
"NAPReg: Nouns As Proxies Regularization for Semantically Aware Cross-Modal Embeddings","1","2","3","2","1","2","11","6","QP1,QP5,QP6,QP7,QS1,QS2"
"LiT: Zero-Shot Transfer with Locked-image text Tuning","2","3","3","2","0","2","12","3","QP1,QP6,QP7"
"De-noised Vision-language Fusion Guided by Visual Cues for E-commerce Product Search","0","2","2","1","0","1","6","3","QP1,QP5,QP6"
"Understanding and Constructing Latent Modality Structures in Multi-Modal Representation Learning","0","3","2","2","0","2","9","4","QP1,QP6,QP7,QS2"
"InVERGe: Intelligent Visual Encoder for Bridging Modalities in Report Generation","1","2","2","2","1","1","9","6","QP1,QP5,QP6,QS1,QS2,QS4"
"MoIL: Momentum Imitation Learning for Efficient Vision-Language Adaptation","1","2","3","2","0","2","10","6","QP1,QP5,QP6,QP7,QS1,QS2"
"MobileCLIP: Fast Image-Text Models through Multi-Modal Reinforced Training","0","3","3","2","1","2","11","5","QP1,QP6,QP7,QS1,QS2"
"Learning Customized Visual Models with Retrieval-Augmented Knowledge","2","3","3","2","1","2","13","7","QP1,QP3,QP6,QP7,QS1,QS3,QS4"
"Multilateral Semantic Relations Modeling for Image Text Retrieval","0","2","2","2","0","1","7","5","QP1,QP2,QP5,QP6,QS2"
"VisualGPT: Data-efficient Adaptation of Pretrained Language Models for Image Captioning","2","2","2","2","1","2","11","7","QP1,QP5,QP6,QS1,QS2,QS3,QS4"
"VL-MFER: A Vision-Language Multimodal Pretrained Model With Multiway-Fuzzy-Experts Bidirectional Retention Network","0","2","2","2","0","1","7","4","QP1,QP5,QP6,QS2"
"EyeGraphGPT: Knowledge Graph Enhanced Multimodal Large Language Model for Ophthalmic Report Generation","2","2","2","1","0","1","8","6","QP1,QP2,QP6,QP7,QS3,QS4"
"Knowledge Graph Enhanced Multimodal Transformer for Image-Text Retrieval","1","3","3","2","0","2","11","5","QP1,QP2,QP6,QP7,QS2"
"Explicit Cross-Modal Representation Learning for Visual Commonsense Reasoning","0","2","2","2","0","1","7","6","QP1,QP2,QP5,QP6,QP7,QS2"
"Learning Aligned Image-Text Representations Using Graph Attentive Relational Network","1","3","3","2","0","2","11","5","QP1,QP2,QP5,QP6,QS2"
"Cross-modal Semantic Enhanced Interaction for Image-Sentence Retrieval","1","3","3","2","0","2","11","5","QP1,QP2,QP5,QP6,QS2"
"Direction-Oriented Visual-Semantic Embedding Model for Remote Sensing Image-Text Retrieval","1","2","2","2","0","1","8","4","QP1,QP5,QP6,QS2"
"Efficient Token-Guided Image-Text Retrieval With Consistent Multimodal Contrastive Training","0","2","3","2","1","2","10","5","QP1,QP6,QP7,QS1,QS2"
"Context-Aware Local-Global Semantic Alignment for Remote Sensing Image-Text Retrieval","1","2","2","2","0","1","8","3","QP1,QP6,QP7"
"A Mutually Textual and Visual Refinement Network for Image-Text Matching","0","2","2","2","0","1","7","6","QP1,QP5,QP6,QP7,QS1,QS2"
"Learning from Inside: Self-driven Siamese Knowledge Generation for Chest X-rays Vision-Language Pre-training","2","3","3","2","1","2","13","7","QP1,QP5,QP6,QP7,QS1,QS2,QS4"
"News Image-Text Matching With News Knowledge Graph","0","2","2","1","0","1","6","3","QP1,QP2,QP6"
"IMRAM: Iterative Matching With Recurrent Attention Memory for Cross-Modal Image-Text Retrieval","0","3","3","2","1","2","11","5","QP1,QP5,QP6,QP7,QS1"
"Feature First: Advancing Image-Text Retrieval Through Improved Visual Features","0","2","2","2","1","1","8","6","QP1,QP2,QP5,QP6,QS1,QS2"
"Dynamic Graph Enhanced Contrastive Learning for Chest X-Ray Report Generation","2","3","3","2","1","2","13","7","QP1,QP2,QP6,QS1,QS2,QS3,QS4"
"HGAN: Hierarchical Graph Alignment Network for Image-Text Retrieval","1","2","2","2","0","1","8","6","QP1,QP2,QP5,QP6,QS2,QS3"
"CLIP2Scene: Towards Label-efficient 3D Scene Understanding by CLIP","2","3","3","2","1","2","13","6","QP1,QP5,QP6,QS1,QS2,QS3"
"Knowledge Enhanced Vision and Language Model for Multi-Modal Fake News Detection","0","2","2","2","1","1","8","5","QP1,QP2,QP6,QS1,QS2"
"POP-VQA: Privacy preserving On-device Personalized Visual Question Answering","1","2","2","2","0","1","8","4","QP1,QP2,QP6,QP7"
"Language Guided Local Infiltration for Interactive Image Retrieval","0","2","2","1","0","1","6","3","QP1,QP5,QP6"
"FRAUD-Net: Fraud News Detection Using Sample Uncertainty and Domain Aware Generalized Network","1","2","2","2","0","1","8","4","QP1,QP5,QP6,QS2"
"Injecting Linguistic Into Visual Backbone for Remote Sensing Visual Grounding","1","2","2","2","0","1","8","3","QP1,QP5,QP6"
"Do Vision and Language Encoders Represent the World Similarly?","0","3","3","2","1","2","11","6","QP1,QP2,QP6,QP7,QS1,QS2"
"Bilateral Knowledge Interaction Network for Referring Image Segmentation","0","2","2","2","1","1","8","5","QP1,QP5,QP6,QS1,QS2"
"GLoRIA: A Multimodal Global-Local Representation Learning Framework for Label-efficient Medical Image Recognition","2","3","3","2","1","2","13","8","QP1,QP5,QP6,QP7,QS1,QS2,QS3,QS4"
"Multi-Modal Representation Learning with Text-Driven Soft Masks","1","2","2","2","0","1","8","6","QP1,QP3,QP5,QP6,QP7,QS2"
"ViLTA: Enhancing Vision-Language Pre-training through Textual Augmentation","1","2","2","2","0","1","8","5","QP1,QP5,QP6,QP7,QS2"
"Task-Oriented Multi-Modal Mutual Learning for Vision-Language Models","2","3","3","2","0","2","12","6","QP1,QP5,QP6,QP7,QS2,QS3"
"Building Vision-Language Models on Solid Foundations with Masked Distillation","1","2","3","2","1","2","11","5","QP1,QP6,QP7,QS2,QS4"
"VILA: Learning Image Aesthetics from User Comments with Vision-Language Pretraining","0","2","2","2","1","1","8","5","QP1,QP6,QP7,QS1,QS2"
"Image-Text Pre-Training for Logo Recognition","1","1","2","1","0","1","6","4","QP1,QP5,QP6,QS2"
"CapsFusion: Rethinking Image-Text Data at Scale","0","2","3","2","1","2","10","5","QP1,QP6,QP7,QS1,QS2"
"Semantic Threads Enabling Image-Text Retrieval via VQA Transformers","0","2","2","2","0","1","7","4","QP1,QP3,QP7,QS4"
"Knowledge-Routed Visual Question Reasoning: Challenges for Deep Representation Embedding","0","2","2","2","0","1","7","3","QP1,QP2,QP6"
"Semantically Enhanced Scene Captions with Physical and Weather Condition Changes","1","2","2","2","0","1","8","5","QP1,QP5,QP6,QP7,QS3"
"Do DALL-E and Flamingo Understand Each Other?","1","3","3","2","1","2","12","5","QP1,QP6,QP7,QS1,QS2"
"LLaVA-SpaceSGG: Visual Instruct Tuning for Open-Vocabulary Scene Graph Generation","1","2","2","2","1","1","9","5","QP1,QP2,QP6,QS1,QS2"
"HARIS: Human-Like Attention for Reference Image Segmentation","0","2","2","2","0","1","7","4","QP1,QP5,QP6,QS2"
"Exploring Synthetic Captions for Remote Sensing Vision-Text Foundational Models","2","2","2","2","1","1","10","6","QP1,QP6,QP7,QS1,QS2,QS3"
"CLIPAG: Towards Generator-Free Text-to-Image Generation","0","2","2","2","0","1","7","5","QP1,QP5,QP6,QP7,QS2"
"Visual Global-Salient-Guided Network for Remote Sensing Image-Text Retrieval","2","3","3","2","0","2","12","7","QP1,QP2,QP5,QP6,QP7,QS2,QS3"
"Patch Ranking: Token Pruning as Ranking Prediction for Efficient CLIP","0","2","2","2","1","1","8","5","QP1,QP5,QP6,QS1,QS2"
"Construction and Applications of Billion-Scale Pre-Trained Multimodal Business Knowledge Graph","1","2","2","2","1","1","9","6","QP1,QP2,QP3,QP6,QS1,QS2"
"Contrastive Feature Masking Open-Vocabulary Vision Transformer","1","2","2","2","0","1","8","4","QP1,QP5,QP6,QP7"
"AttriPrompter: Auto-Prompting With Attribute Semantics for Zero-Shot Nuclei Detection via Visual-Language Pre-Trained Models","2","2","2","2","1","2","11","6","QP1,QP3,QP6,QS1,QS2,QS4"
"RILS: Masked Visual Reconstruction in Language Semantic Space","0","2","3","2","1","2","10","5","QP1,QP6,QP7,QS1,QS2"
"PLA: Language-Driven Open-Vocabulary 3D Scene Understanding","2","3","3","2","1","2","13","7","QP1,QP3,QP6,QP7,QS1,QS2,QS3"
"ZeroCap: Zero-Shot Image-to-Text Generation for Visual-Semantic Arithmetic","2","2","2","1","1","1","9","5","QP1,QP6,QP7,QS1,QS3"
"Semantic Image Retrieval Using Scene Graphs and Natural Language Queries","1","2","2","1","0","1","7","4","QP1,QP2,QP6,QS2"
"Mobile User Interface Element Detection Via Adaptively Prompt Tuning","1","2","2","2","1","1","9","6","QP1,QP5,QP6,QS1,QS2,QS3"
"MedKLIP: Medical Knowledge Enhanced Language-Image Pre-Training for X-ray Diagnosis","2","3","3","2","1","2","13","8","QP1,QP5,QP6,QP7,QS1,QS2,QS3,QS4"
"Exploring CLIP's Dense Knowledge for Weakly Supervised Semantic Segmentation","2","3","3","2","1","2","13","6","QP1,QP3,QP5,QP6,QS1,QS2"
"Reasoning to Attend: Try to Understand How SEG Token Works","0","3","3","2","1","2","11","6","QP1,QP5,QP6,QP7,QS1,QS2"
"Frozen Transformers in Language Models Are Effective Visual Encoder Layers","0","3","3","2","1","2","11","6","QP1,QP5,QP6,QP7,QS1,QS2"
"LLM-CXR: Instruction-Finetuned LLM for CXR Image Understanding and Generation","1","2","2","2","1","1","9","6","QP1,QP6,QP7,QS1,QS2,QS4"
"Revisiting Multimodal Representation in Contrastive Learning: From Patch and Token Embeddings to Finite Discrete Tokens","0","2","3","2","1","2","10","6","QP1,QP5,QP6,QP7,QS1,QS2"
"MAGVLT: Masked Generative Vision-and-Language Transformer","0","3","3","2","1","2","11","6","QP1,QP5,QP6,QP7,QS1,QS2"
"ConTEXTual Net: A Multimodal Vision-Language Model for Segmentation of Pneumothorax","2","2","2","2","1","1","10","6","QP1,QP5,QP6,QS1,QS3,QS4"
"Multimodal Adaptive Distillation for Leveraging Unimodal Encoders for Vision-Language Tasks","2","2","3","2","0","2","11","7","QP1,QP3,QP5,QP6,QP7,QS1,QS2"
"Active Prompt Learning with Vision-Language Model Priors","2","3","2","2","1","2","12","7","QP1,QP3,QP4,QP5,QP6,QS2,QS3"
"ProbVLM: Probabilistic Adapter for Frozen Vision-Language Models","2","3","3","2","1","2","13","7","QP1,QP4,QP5,QP6,QP7,QS1,QS2"
"Context-Based Semantic-Aware Alignment for Semi-Supervised Multi-Label Learning","2","2","2","2","0","2","10","7","QP1,QP2,QP3,QP5,QP6,QS2,QS3"
"DuSSS: Dual Semantic Similarity-Supervised Vision-Language Model for Semi-Supervised Medical Image Segmentation","2","2","2","2","1","2","11","7","QP1,QP3,QP6,QS1,QS2,QS3,QS4"
"GraphVL: Graph-Enhanced Semantic Modeling via Vision-Language Models for Generalized Class Discovery","2","2","2","2","0","1","9","5","QP1,QP2,QP3,QP6,QS2"
"Data Adaptive Traceback for Vision-Language Foundation Models in Image Classification","1","2","2","1","0","1","7","4","QP1,QP3,QP6,QS2"
"S-CLIP: Semi-supervised Vision-Language Learning using Few Specialist Captions","2","3","3","2","1","2","13","6","QP1,QP3,QP6,QP7,QS1,QS3"
"LViT: Language meets Vision Transformer in Medical Image Segmentation","2","3","3","2","1","2","13","8","QP1,QP3,QP5,QP6,QS1,QS2,QS3,QS4"
"The Dialog Must Go On: Improving Visual Dialog via Generative Self-Training","2","2","2","2","1","1","10","6","QP1,QP3,QP6,QS1,QS2,QS3"
"Learning Multimodal VAEs through Mutual Supervision","2","3","2","2","1","2","12","6","QP1,QP3,QP5,QP6,QP7,QS1,QS2"
"Meta-Entity Driven Triplet Mining for Aligning Medical Vision-Language Models","2","2","2","2","1","2","11","8","QP1,QP4,QP5,QP6,QP7,QS1,QS2,QS4"
"LRSCLIP: A Vision-Language Foundation Model for Aligning Remote Sensing Image with Longer Text","1","2","2","2","1","1","9","5","QP1,QP5,QP6,QP7,QS1"
"Derm1M: A Million-scale Vision-Language Dataset Aligned with Clinical Ontology Knowledge for Dermatology","1","2","2","2","1","2","10","3","QP1,QP6,QP7"
"Anatomy-Aware Conditional Image-Text Retrieval","2","2","2","2","0","2","10","7","QP1,QP5,QP6,QP7,QS2,QS3,QS4"
"Poisoned-MRAG: Knowledge Poisoning Attacks to Multimodal Retrieval Augmented Generation","0","2","2","2","0","1","7","5","QP1,QP5,QP6,QP7,QS2"
"DoraCycle: Domain-Oriented Adaptation of Unified Generative Model in Multimodal Cycles","2","2","2","2","1","1","10","6","QP1,QP3,QP6,QP7,QS1,QS3"
"MedUnifier: Unifying Vision-and-Language Pre-training on Medical Data with Vision Generation Task","2","2","2","2","0","2","10","6","QP1,QP6,QP7,QS2,QS3,QS4"
"Explainable Multi-modal Wound Infection Classification from Images Augmented with Generated Captions","2","2","2","2","0","1","9","5","QP1,QP5,QP6,QS3,QS4"
"UniGS: Unified Language-Image-3D Pretraining with Gaussian Splatting","0","3","2","2","1","2","10","4","QP1,QP6,QP7,QS1"
"Mitigating the Modality Gap: Few-Shot Out-of-Distribution Detection with Multi-modal Prototypes","2","2","2","2","0","1","9","5","QP1,QP5,QP6,QS2,QS3"
"Dynamic Adapter with Semantics Disentangling for Cross-lingual Cross-modal Retrieval","1","2","2","2","1","1","9","5","QP1,QP6,QP7,QS1,QS3"
"Embedding and Enriching Explicit Semantics for Visible-Infrared Person Re-Identification","0","2","2","2","0","1","7","4","QP1,QP5,QP6,QS2"
"CLIP-PING: Boosting Lightweight Vision-Language Models with Proximus Intrinsic Neighbors Guidance","1","2","2","2","0","1","8","5","QP1,QP6,QP7,QS2,QS3"
"CLIPS: An Enhanced CLIP Framework for Learning with Synthetic Captions","1","2","2","2","1","1","9","4","QP1,QP6,QP7,QS1"
"Uni-Mlip: Unified Self-supervision for Medical Vision Language Pre-training","2","3","2","1","0","2","10","6","QP1,QP6,QP7,QS2,QS3,QS4"
"Multi-Stage Knowledge Integration of Vision-Language Models for Continual Learning","1","2","2","2","0","1","8","4","QP1,QP5,QP6,QS2"
"GSSF: Generalized Structural Sparse Function for Deep Cross-modal Metric Learning","0","3","2","2","0","1","8","5","QP1,QP2,QP5,QP6,QS2"
"CMAL: A Novel Cross-Modal Associative Learning Framework for Vision-Language Pre-Training","0","2","3","2","1","2","10","6","QP1,QP5,QP6,QP7,QS1,QS2"
"NEVLP: Noise-Robust Framework for Efficient Vision-Language Pre-training","1","2","2","2","0","1","8","4","QP1,QP6,QP7,QS2"
"EyeCLIP: A visual-language foundation model for multi-modal ophthalmic image analysis","2","3","3","2","1","2","13","7","QP1,QP6,QP7,QS1,QS2,QS3,QS4"
"Efficient and Versatile Robust Fine-Tuning of Zero-shot Models","2","2","3","2","1","2","12","5","QP1,QP6,QP7,QS1,QS2"
"Leveraging Entity Information for Cross-Modality Correlation Learning: The Entity-Guided Multimodal Summarization","1","2","2","2","1","1","9","5","QP1,QP2,QP6,QS1,QS2"
"Object-Aware Query Perturbation for Cross-Modal Image-Text Retrieval","0","2","2","2","1","1","8","6","QP1,QP5,QP6,QP7,QS1,QS2"
"Efficient and Long-Tailed Generalization for Pre-trained Vision-Language Model","2","2","2","2","1","1","10","5","QP1,QP6,QP7,QS1,QS3"
"One Perturbation is Enough: On Generating Universal Adversarial Perturbations against Vision-Language Pre-training Models","0","2","2","2","0","1","7","4","QP1,QP6,QP7,QS2"
"Enhancing medical vision-language contrastive learning via inter-matching relation modelling","1","3","3","2","0","2","11","8","QP1,QP2,QP5,QP6,QP7,QS2,QS3,QS4"
"IQAGPT: Image Quality Assessment with Vision-language and ChatGPT Models","1","2","2","2","0","1","8","6","QP1,QP5,QP6,QP7,QS3,QS4"
"CL2CM: Improving Cross-Lingual Cross-Modal Retrieval via Cross-Lingual Knowledge Transfer","2","2","2","2","0","1","9","7","QP1,QP3,QP5,QP6,QP7,QS2,QS3"
"VLATTACK: Multimodal Adversarial Attacks on Vision-Language Tasks via Pre-trained Models","0","2","3","2","1","1","9","4","QP1,QP5,QP6,QP7"
"Dual-view Curricular Optimal Transport for Cross-lingual Cross-modal Retrieval","2","3","2","2","0","2","11","7","QP1,QP3,QP5,QP6,QP7,QS2,QS3"
"Towards Fast and Accurate Image-Text Retrieval with Self-Supervised Fine-Grained Alignment","1","2","2","2","1","1","9","5","QP1,QP5,QP6,QS1,QS2"
"DLIP: Distilling Language-Image Pre-training","0","2","2","2","0","1","7","4","QP1,QP6,QP7,QS2"
"DiffDis: Empowering Generative Diffusion Model with Cross-Modal Discrimination Capability","0","2","2","2","0","1","7","4","QP1,QP6,QP7,QS2"
"Switch-BERT: Learning to Model Multimodal Interactions by Switching Attention and Input","0","2","2","2","0","1","7","4","QP1,QP6,QP7,QS2"
"Global and Local Semantic Completion Learning for Vision-Language Pre-training","0","2","2","2","1","1","8","5","QP1,QP5,QP6,QP7,QS1"
"Dense and Aligned Captions (DAC) Promote Compositional Reasoning in VL Models","1","2","3","2","1","2","11","6","QP1,QP3,QP6,QP7,QS1,QS2"
"Improved Probabilistic Image-Text Representations","0","3","3","2","1","2","11","6","QP1,QP5,QP6,QP7,QS1,QS2"
"Weakly Supervised Vision-and-Language Pre-training with Relative Representations","2","2","2","2","1","2","11","6","QP1,QP6,QP7,QS1,QS2,QS3"
"UNIMO-3: Multi-granularity Interaction for Vision-Language Representation Learning","0","2","2","2","0","1","7","5","QP1,QP5,QP6,QP7,QS2"
"Probing the Role of Positional Information in Vision-Language Models","0","2","2","2","1","1","8","5","QP1,QP6,QP7,QS1,QS2"
"Multi-task Paired Masking with Alignment Modeling for Medical Vision-Language Pre-training","2","2","3","2","0","2","11","7","QP1,QP5,QP6,QP7,QS2,QS3,QS4"
"Continual Vision-Language Representation Learning with Off-Diagonal Information","1","2","2","2","0","1","8","4","QP1,QP6,QP7,QS2"
"SoftCLIP: Softer Cross-modal Alignment Makes CLIP Stronger","0","2","3","2","1","2","10","5","QP1,QP5,QP6,QP7,QS2"
"Vision and Structured-Language Pretraining for Cross-Modal Food Retrieval","1","2","2","2","1","1","9","6","QP1,QP2,QP6,QP7,QS1,QS4"
"CapEnrich: Enriching Caption Semantics for Web Images via Cross-modal Pre-trained Knowledge","0","2","2","2","1","1","8","5","QP1,QP2,QP6,QS1,QS2"
"ERNIE-UniX2: A Unified Cross-lingual Cross-modal Framework for Understanding and Generation","0","2","2","2","0","1","7","4","QP1,QP6,QP7,QS2"
"FaD-VLP: Fashion Vision-and-Language Pre-training towards Unified Retrieval and Captioning","0","2","2","2","0","1","7","3","QP1,QP6,QP7"
"ERNIE-ViL 2.0: Multi-view Contrastive Learning for Image-Text Pre-training","0","2","3","2","1","2","10","4","QP1,QP6,QP7,QS1"
"Efficient Vision-Language Pretraining with Visual Concepts and Hierarchical Alignment","2","2","3","2","1","2","12","8","QP1,QP2,QP3,QP5,QP6,QP7,QS1,QS2"
"Dynamic Traceback Learning for Medical Report Generation","1","2","3","2","1","2","11","7","QP1,QP5,QP6,QP7,QS1,QS2,QS4"
"Boon: A Neural Search Engine for Cross-Modal Information Retrieval","0","1","2","2","0","1","6","4","QP1,QP6,QP7,QS2"
"PRIOR: Prototype Representation Joint Learning from Medical Images and Reports","2","3","3","2","1","2","13","8","QP1,QP5,QP6,QP7,QS1,QS2,QS3,QS4"
"VITR: Augmenting Vision Transformers with Relation-Focused Learning for Cross-Modal Information Retrieval","0","2","2","2","0","1","7","5","QP1,QP2,QP5,QP6,QS2"
"Learning by Hallucinating: Vision-Language Pre-training with Weak Supervision","2","2","2","2","0","1","9","4","QP1,QP6,QP7,QS2"
"Treble Counterfactual VLMs: A Causal Approach to Hallucination","0","3","2","2","0","1","8","3","QP1,QP6,QP7"
"Counterfactually Measuring and Eliminating Social Bias in Vision-Language Pre-training Models","1","2","2","2","1","1","9","6","QP1,QP6,QP7,QS1,QS2,QS3"
"VLMixer: Unpaired Vision-Language Pre-training via Cross-Modal CutMix","2","2","2","2","1","2","11","5","QP1,QP6,QP7,QS1,QS2"
"Cross-View Language Modeling: Towards Unified Cross-Lingual Cross-Modal Pre-training","0","2","2","2","1","1","8","5","QP1,QP6,QP7,QS1,QS2"
"Prompt-based Learning for Unpaired Image Captioning","2","2","2","1","0","1","8","4","QP1,QP3,QP6,QS2"
"COTS: Collaborative Two-Stream Vision-Language Pre-Training Model for Cross-Modal Retrieval","0","2","3","2","0","2","9","5","QP1,QP5,QP6,QP7,QS2"
"Robust Cross-Modal Representation Learning with Progressive Self-Distillation","1","2","2","2","0","1","8","5","QP1,QP5,QP6,QP7,QS2"
"Single-Stream Multi-Level Alignment for Vision-Language Pretraining","0","2","3","2","1","2","10","6","QP1,QP5,QP6,QP7,QS1,QS2"
"Unsupervised Vision-and-Language Pre-training via Retrieval-based Multi-Granular Alignment","2","3","2","2","0","2","11","5","QP1,QP5,QP6,QP7,QS2"
"OFA: Unifying Architectures, Tasks, and Modalities Through a Simple Sequence-to-Sequence Learning Framework","1","3","3","2","1","2","12","6","QP1,QP3,QP6,QP7,QS1,QS2"
"VT-CLIP: Enhancing Vision-Language Models with Visual-guided Texts","1","2","2","2","0","1","8","5","QP1,QP5,QP6,QS2,QS3"
"UFO: A UniFied TransfOrmer for Vision-Language Representation Learning","0","2","2","2","0","1","7","4","QP1,QP6,QP7,QS2"
"FILIP: Fine-grained Interactive Language-Image Pre-Training","0","3","3","2","0","2","10","4","QP1,QP5,QP6,QP7"
"KD-VLP: Improving End-to-End Vision-and-Language Pretraining with Object Knowledge Distillation","0","2","2","2","0","1","7","5","QP1,QP5,QP6,QP7,QS2"
"EfficientCLIP: Efficient Cross-Modal Pre-training by Ensemble Confident Learning and Language Modeling","2","2","2","2","0","1","9","5","QP1,QP3,QP6,QP7,QS3"
"ROSITA: Enhancing Vision-and-Language Semantic Alignments via Cross- and Intra-modal Knowledge Integration","0","3","3","2","1","2","11","7","QP1,QP2,QP5,QP6,QP7,QS1,QS2"
"Align before Fuse: Vision and Language Representation Learning with Momentum Distillation","2","3","3","2","1","2","13","7","QP1,QP3,QP5,QP6,QP7,QS1,QS2"
"E2E-VLP: End-to-End Vision-Language Pre-training Enhanced by Visual Learning","0","2","2","2","0","1","7","4","QP1,QP6,QP7,QS2"
"Seeing Out of tHe bOx: End-to-End Pre-training for Vision-Language Representation Learning","0","3","3","2","1","2","11","6","QP1,QP5,QP6,QP7,QS1,QS2"
"UC2: Universal Cross-lingual Cross-modal Vision-and-Language Pre-training","1","2","2","2","0","1","8","4","QP1,QP5,QP6,QS2"
"SemVLP: Vision-Language Pre-training by Aligning Semantics at Multiple Levels","0","2","2","2","0","1","7","5","QP1,QP5,QP6,QP7,QS2"
"WenLan: Bridging Vision and Language by Large-Scale Multi-Modal Pre-Training","0","2","2","2","0","1","7","3","QP1,QP6,QP7"
"Scaling Up Visual and Vision-Language Representation Learning With Noisy Text Supervision","1","3","3","2","0","2","11","3","QP1,QP6,QP7"
"MiniVLM: A Smaller and Faster Vision-Language Model","1","2","2","2","0","1","8","5","QP1,QP3,QP6,QP7,QS2"
"Beyond the Deep Metric Learning: Enhance the Cross-Modal Matching with Adversarial Discriminative Domain Regularization","1","2","2","2","0","1","8","4","QP1,QP6,QP7,QS2"
"ERNIE-ViL: Knowledge Enhanced Vision-Language Representations Through Scene Graph","0","2","2","2","0","1","7","5","QP1,QP2,QP6,QP7,QS2"
"Behind the Scene: Revealing the Secrets of Pre-trained Vision-and-Language Models","0","3","3","2","1","2","11","7","QP1,QP2,QP5,QP6,QP7,QS1,QS2"
"A Novel Attention-based Aggregation Function to Combine Vision and Language","0","2","2","2","0","1","7","4","QP1,QP6,QP7,QS2"
"Oscar: Object-Semantics Aligned Pre-training for Vision-Language Tasks","0","3","3","2","1","2","11","6","QP1,QP5,QP6,QP7,QS1,QS2"
"Distilled Dual-Encoder Model for Vision-Language Understanding","0","2","2","1","0","1","6","3","QP1,QP6,QP7"
"Self-Supervised Image-to-Text and Text-to-Image Synthesis","1","1","1","1","0","1","5","5","QP1,QP6,QP7,QS1,QS2"
"L-Verse: Bidirectional Generation Between Image and Text","0","2","2","2","1","1","8","5","QP1,QP6,QP7,QS1,QS2"
"TCIC: Theme Concepts Learning Cross Language and Vision for Image Captioning","0","2","2","2","0","1","7","4","QP1,QP2,QP6,QS2"
"DashCLIP: Leveraging multimodal models for generating semantic embeddings for DoorDash","0","1","2","1","0","1","5","4","QP1,QP5,QP6,QP7"
"The Power of One: A Single Example is All it Takes for Segmentation in VLMs","2","2","3","2","0","2","11","5","QP1,QP5,QP6,QS2,QS3"
"Contrast-Aware Calibration for Fine-Tuned CLIP: Leveraging Image-Text Alignment","1","2","2","2","0","1","8","5","QP1,QP6,QP7,QS2,QS3"
